{
  "kind": "scheme-tokens/compiled-color-scheme",
  "formatVersion": 1,
  "modes": ["light", "dark"],
  "defaultMode": "light",
  "tokens": {
    "button.background": {
      "visibility": "public",
      "valueByMode": {
        "light": {
          "colorSpace": "srgb",
          "components": [0.4, 0.31, 0.64],
          "alpha": 1
        },
        "dark": {
          "colorSpace": "srgb",
          "components": [0.82, 0.74, 1],
          "alpha": 1
        }
      },
      "origin": {
        "kind": "semanticToken",
        "origin": {
          "kind": "graph"
        },
        "target": "brand.primary"
      },
      "dependenciesByMode": {
        "light": ["brand.primary"],
        "dark": ["brand.primary"]
      }
    },
    "button.foreground": {
      "visibility": "public",
      "valueByMode": {
        "light": {
          "colorSpace": "srgb",
          "components": [1, 1, 1],
          "alpha": 1
        },
        "dark": {
          "colorSpace": "srgb",
          "components": [0.22, 0.12, 0.45],
          "alpha": 1
        }
      },
      "origin": {
        "kind": "semanticToken",
        "origin": {
          "kind": "graph"
        },
        "target": "brand.on-primary"
      },
      "dependenciesByMode": {
        "light": ["brand.on-primary"],
        "dark": ["brand.on-primary"]
      }
    }
  }
}
